Group,sent_type,struc,prime_type,verb,verb_num,sent_id,sentence,question,response,truncated
list_1A,filler,filler,NA,NA,NA,Filler48,Adam's hand shook slightly as,Was Adam trying to unlock a door?,Yes,yes
list_1A,prime,rrc,NA,recorded,1,recorded1,The priest recorded by the mob preached against violence.,NA,NA,no
list_1A,prime,rrc,NA,recorded,2,recorded2,The management recorded by the employee talked about the importance of privacy.,NA,NA,no
list_1A,target,rrc,rrc,recorded,3,recorded3,The dancer recorded,NA,NA,yes
list_1A,filler,filler,NA,NA,NA,Filler47,Lily trod on a lot of toes when she joined the company.,Did Lily upset people when she joined the company?,Yes,no
list_1A,prime,urc,NA,loved,1,loved1,The landlord who was loved by his tenants was very considerate.,NA,NA,no
list_1A,prime,urc,NA,loved,2,loved2,The comedian who was loved by the audience impersonated a famous celebrity.,NA,NA,no
list_1A,target,rrc,urc,loved,3,loved3,The kid loved,NA,NA,yes
list_1A,filler,filler,NA,NA,NA,Filler46,Maria went upstairs to,Did Maria change into a dress?,No,yes
list_1A,prime,urc,NA,described,1,described1,The boy who was described by the lady glowed with joy.,NA,NA,no
list_1A,prime,urc,NA,described,2,described2,The secretary who was described by the visitor waited patiently.,NA,NA,no
list_1A,target,rrc,urc,described,3,described3,The chemist described,NA,NA,yes
list_1A,filler,filler,NA,NA,NA,Filler45,Patrick woke up to,Were Patrick's parents around when he woke up?,No,yes
list_1A,filler,filler,NA,NA,NA,Filler13,The friends studied,Did the friends study independently?,No,yes
list_1A,filler,filler,NA,NA,NA,Filler9,Foreigners unfailingly fall in love with the place.,Did foreigners like the place?,Yes,no
list_1A,prime,amv,NA,examined,1,examined1,The defendant examined the lawyer and turned out to be unreliable.,NA,NA,no
list_1A,prime,amv,NA,examined,2,examined2,The engineer examined a licensor and passed with flying colors.,NA,NA,no
list_1A,target,rrc,amv,examined,3,examined3,The industrialist examined,NA,NA,yes
list_1A,filler,filler,NA,NA,NA,Filler6,The married couple arose before dawn in order to prepare for the trip.,Did the couple wake up early?,Yes,no
list_1A,filler,filler,NA,NA,NA,Filler44,The bulldozers were removing,Was the building destroyed?,Yes,yes
list_1A,filler,filler,NA,NA,NA,Filler22,The rabbit hopped,Did the rabbit make it to the other side safely?,Yes,yes
list_1A,prime,urc,NA,envied,1,envied1,The officer who was envied by the assistant quit the job.,NA,NA,no
list_1A,prime,urc,NA,envied,2,envied2,The principal who was envied by the administration complained about the school's problems.,NA,NA,no
list_1A,target,rrc,urc,envied,3,envied3,The man envied,NA,NA,yes
list_1A,filler,filler,NA,NA,NA,Filler43,The contestants ate,Did the contestants eat less than 10 hot dogs?,No,yes
list_1A,prime,urc,NA,captured,1,captured1,The policeman who was captured by the kidnapper refused to divulge any information.,NA,NA,no
list_1A,prime,urc,NA,captured,2,captured2,The witch who was captured by the peasant cackled gleefully.,NA,NA,no
list_1A,target,rrc,urc,captured,3,captured3,The suspect captured,NA,NA,yes
list_1A,filler,filler,NA,NA,NA,Filler16,The deer froze in,Were the deer scared?,Yes,yes
list_1A,filler,filler,NA,NA,NA,Filler23,The businessman strode,Was the businessman determined?,Yes,yes
list_1A,filler,filler,NA,NA,NA,Filler3,A different kind of fire arose within Andrew as he thought about the new idea.,Was Andrew passionate about the idea?,Yes,no
list_1A,filler,filler,NA,NA,NA,Filler42,The dieting boy deprived himself of sweets and sugars.,Did the boy want to be healthier?,Yes,no
list_1A,prime,urc,NA,scratched,1,scratched1,The girl who was scratched by the cat enjoyed the sunny afternoon.,NA,NA,no
list_1A,prime,urc,NA,scratched,2,scratched2,The toddler who was scratched by the table exclaimed in surprise.,NA,NA,no
list_1A,target,rrc,urc,scratched,3,scratched3,The dog scratched,NA,NA,yes
list_1A,filler,filler,NA,NA,NA,Filler41,They drew lots to settle who should make dinner that day.,Did they draw lots to decide who should make lunch?,No,no
list_1A,prime,rrc,NA,consoled,1,consoled1,The widow consoled by her family felt better eventually.,NA,NA,no
list_1A,prime,rrc,NA,consoled,2,consoled2,The teenager consoled by the friend went back home sullenly.,NA,NA,no
list_1A,target,rrc,rrc,consoled,3,consoled3,The woman consoled,NA,NA,yes
list_1A,filler,filler,NA,NA,NA,Filler40,The flags in the gym,Were the flags chosen at random?,No,yes
list_1A,prime,amv,NA,attacked,1,attacked1,The troops attacked the terrorists and suffered heavy losses.,NA,NA,no
list_1A,prime,amv,NA,attacked,2,attacked2,The lion attacked the hunter and staggered back into the forest.,NA,NA,no
list_1A,target,rrc,amv,attacked,3,attacked3,The senator attacked,NA,NA,yes
list_1A,filler,filler,NA,NA,NA,Filler15,The basketball player's ankle swelled as he limped off the court.,Was the player injured?,Yes,no
list_1A,filler,filler,NA,NA,NA,Filler39,The wallpaper was,Was the wallpaper a bad choice?,No,yes
list_1A,prime,prog_rrc,NA,paid,1,paid1,The cashier being paid by the customer muttered something inaudibly.,NA,NA,no
list_1A,prime,prog_rrc,NA,paid,2,paid2,The organization being paid by the government expanded its misson.,NA,NA,no
list_1A,target,rrc,prog_rrc,paid,3,paid3,The broker paid,NA,NA,yes
list_1A,filler,filler,NA,NA,NA,Filler38,The school principal worked,Was the principal busy?,Yes,yes
list_1A,prime,rrc,NA,accompanied,1,accompanied1,The prince accompanied by the duke arrived at the palace.,NA,NA,no
list_1A,prime,rrc,NA,accompanied,2,accompanied2,The children accompanied by their guardian skipped to the park.,NA,NA,no
list_1A,target,rrc,rrc,accompanied,3,accompanied3,The toddler accompanied,NA,NA,yes
list_1A,filler,filler,NA,NA,NA,Filler37,The girls on the basketball team,Were the girls lazy all summer?,No,yes
list_1A,prime,amv,NA,recognized,1,recognized1,The man recognized the spy and took off down the street.,NA,NA,no
list_1A,prime,amv,NA,recognized,2,recognized2,The actor recognized the reporter and waved enthusiastically.,NA,NA,no
list_1A,target,rrc,amv,recognized,3,recognized3,The poet recognized,NA,NA,yes
list_1A,filler,filler,NA,NA,NA,Filler36,Each of the cab drivers had their own favorite route to get to the airport.,Was there more than one way to get to the airport?,Yes,no
list_1A,prime,prog_rrc,NA,chased,1,chased1,The dog being chased by the boy played with the ball.,NA,NA,no
list_1A,prime,prog_rrc,NA,chased,2,chased2,The monkey being chased by a hatter stole his hats.,NA,NA,no
list_1A,target,rrc,prog_rrc,chased,3,chased3,The thief chased,NA,NA,yes
list_1A,filler,filler,NA,NA,NA,Filler35,The storekeepers were afraid that,Were some people worried about the hometeam winning?,Yes,yes
list_1A,prime,rrc,NA,studied,1,studied1,The soldier studied by the general moved up in ranks.,NA,NA,no
list_1A,prime,rrc,NA,studied,2,studied2,The writer studied by the scholar wrote a radical book.,NA,NA,no
list_1A,target,rrc,rrc,studied,3,studied3,The apprentice studied,NA,NA,yes
list_1A,filler,filler,NA,NA,NA,Filler34,The bathroom paint was,Was the paint in the hotel bathrooms in good shape?,No,yes
list_1A,prime,rrc,NA,betrayed,1,betrayed1,The politician betrayed by the party denied the allegations.,NA,NA,no
list_1A,prime,rrc,NA,betrayed,2,betrayed2,The king betrayed by the genie arrested the innocent woman.,NA,NA,no
list_1A,target,rrc,rrc,betrayed,3,betrayed3,The businessman betrayed,NA,NA,yes
list_1A,filler,filler,NA,NA,NA,Filler14,The woman eagerly waited,Was the woman looking forward to hearing some news?,Yes,yes
list_1A,filler,filler,NA,NA,NA,Filler33,All the parents at the meeting,Did the parents like the new policy?,No,yes
list_1A,prime,amv,NA,challenged,1,challenged1,The protestors challenged the authority and marched on the streets.,NA,NA,no
list_1A,prime,amv,NA,challenged,2,challenged2,The scientist challenged the journalist and demonstrated the value of the invention.,NA,NA,no
list_1A,target,rrc,amv,challenged,3,challenged3,The dragon challenged,NA,NA,yes
list_1A,filler,filler,NA,NA,NA,Filler8,The student pretended,Was the student really sick?,No,yes
list_1A,filler,filler,NA,NA,NA,Filler20,The children shrank back from the clown in revulsion.,Did the children like the clown?,No,no
list_1A,filler,filler,NA,NA,NA,Filler19,The energetic cat batted at the dust specks floating in the air.,Was the cat lazy?,No,no
list_1A,filler,filler,NA,NA,NA,Filler10,The jogger inhaled,Was the jogger out of breath?,Yes,yes
list_1A,filler,filler,NA,NA,NA,Filler32,The pilots flew,Did the pilots enjoy themselves in the city?,Yes,yes
list_1A,prime,prog_rrc,NA,selected,1,selected1,The applicant being selected by the company gained more information.,NA,NA,no
list_1A,prime,prog_rrc,NA,selected,2,selected2,The professor being selected by the university made plans to move to a new city.,NA,NA,no
list_1A,target,rrc,prog_rrc,selected,3,selected3,The chef selected,NA,NA,yes
list_1A,filler,filler,NA,NA,NA,Filler31,The laptops were,Were the laptops afforable for the students?,No,yes
list_1A,prime,amv,NA,congratulated,1,congratulated1,The captain congratulated the team and jumped in excitement.,NA,NA,no
list_1A,prime,amv,NA,congratulated,2,congratulated2,The actress congratulated the director and talked to the media happily.,NA,NA,no
list_1A,target,rrc,amv,congratulated,3,congratulated3,The governor congratulated,NA,NA,yes
list_1A,filler,filler,NA,NA,NA,Filler30,The film critic wept at,Was the film critic incapable of crying?,No,yes
list_1A,filler,filler,NA,NA,NA,Filler11,The singer practiced,Was the singer able to hit the high notes without practicing?,No,yes
list_1A,prime,prog_rrc,NA,encouraged,1,encouraged1,The gymnast being encouraged by the coach participated in the contest.,NA,NA,no
list_1A,prime,prog_rrc,NA,encouraged,2,encouraged2,The musician being encouraged by the crowd performed a breathtaking piece.,NA,NA,no
list_1A,target,rrc,prog_rrc,encouraged,3,encouraged3,The teacher encouraged,NA,NA,yes
list_1A,filler,filler,NA,NA,NA,Filler2,The ornate clock chimed,Was the clock working?,Yes,yes
list_1A,filler,filler,NA,NA,NA,Filler29,The sparkles on the celebrity's dress glittered under the harsh lighting.,Did the outfit have sparkles on it?,Yes,no
list_1A,filler,filler,NA,NA,NA,Filler17,The boy got up to,Did the boy get out of his seat?,Yes,yes
list_1A,filler,filler,NA,NA,NA,Filler7,The spy came,Did the spy make a lot of noise?,No,yes
list_1A,prime,rrc,NA,identified,1,identified1,The thief identified by the victim ran away in fear.,NA,NA,no
list_1A,prime,rrc,NA,identified,2,identified2,The warden identified by the prisoner cracked the walnuts enthusiastically.,NA,NA,no
list_1A,target,rrc,rrc,identified,3,identified3,The student identified,NA,NA,yes
list_1A,filler,filler,NA,NA,NA,Filler28,The girl apologized,Was the girl caught staying out late?,Yes,yes
list_1A,prime,urc,NA,admired,1,admired1,The singer who was admired by her fans sang beautifully.,NA,NA,no
list_1A,prime,urc,NA,admired,2,admired2,The princess who was admired by the magician went into a trance.,NA,NA,no
list_1A,target,rrc,urc,admired,3,admired3,The employee admired,NA,NA,yes
list_1A,filler,filler,NA,NA,NA,Filler27,The teacher saw,Was the teacher fooled by the student?,No,yes
list_1A,filler,filler,NA,NA,NA,Filler21,The chairman spoke,Did the chairman speak for 45 minutes?,No,yes
list_1A,prime,prog_rrc,NA,approached,1,approached1,The student being approached by the teacher passed the exam.,NA,NA,no
list_1A,prime,prog_rrc,NA,approached,2,approached2,The clerk being approached by his manager submitted the report.,NA,NA,no
list_1A,target,rrc,prog_rrc,approached,3,approached3,The spy approached,NA,NA,yes
list_1A,filler,filler,NA,NA,NA,Filler4,John became frustrated,Did John get less frustrated over time?,No,yes
list_1A,filler,filler,NA,NA,NA,Filler26,The fish swam,Did the fish avoid Jane?,No,yes
list_1A,filler,filler,NA,NA,NA,Filler1,The new student talked,Were there some classmates the new student did not talk to?,No,yes
list_1A,prime,prog_rrc,NA,introduced,1,introduced1,The speaker being introduced by the chairman charmed everyone with the speech.,NA,NA,no
list_1A,prime,prog_rrc,NA,introduced,2,introduced2,The producer being introduced by the association won many awards.,NA,NA,no
list_1A,target,rrc,prog_rrc,introduced,3,introduced3,The elf introduced,NA,NA,yes
list_1A,filler,filler,NA,NA,NA,Filler12,The babysitter ran,Were the children well behaved?,No,yes
list_1A,filler,filler,NA,NA,NA,Filler18,The talented lawyer argued,Was the lawyer talented?,Yes,yes
list_1A,filler,filler,NA,NA,NA,Filler5,The kindergartner bade good bye to her mother and ran to her friends.,Did the kindergartner bid good bye to her father?,No,no
list_1A,filler,filler,NA,NA,NA,Filler25,The teenagers swore,Did the teenagers think that they were going to continue being good friends?,Yes,yes
list_1A,prime,amv,NA,sketched,1,sketched1,The culprit sketched the investigator and managed to escape arrest.,NA,NA,no
list_1A,prime,amv,NA,sketched,2,sketched2,The apprentice sketched the artist and rolled up the canvas.,NA,NA,no
list_1A,target,rrc,amv,sketched,3,sketched3,The painter sketched,NA,NA,yes
list_1A,filler,filler,NA,NA,NA,Filler24,The students participated,Did the students want to participate in the festival?,Yes,yes
list_1B,filler,filler,NA,NA,NA,Filler48,Adam's hand shook slightly as,Was Adam trying to unlock a door?,Yes,yes
list_1B,prime,urc,NA,recorded,1,recorded1,The priest who was recorded by the mob preached against violence.,NA,NA,no
list_1B,prime,urc,NA,recorded,2,recorded2,The management which was recorded by the employee talked about the importance of privacy.,NA,NA,no
list_1B,target,rrc,urc,recorded,3,recorded3,The dancer recorded,NA,NA,yes
list_1B,filler,filler,NA,NA,NA,Filler47,Lily trod on a lot of toes when she joined the company.,Did Lily upset people when she joined the company?,Yes,no
list_1B,prime,prog_rrc,NA,loved,1,loved1,The landlord being loved by his tenants was very considerate.,NA,NA,no
list_1B,prime,prog_rrc,NA,loved,2,loved2,The comedian being loved by the audience impersonated a famous celebrity.,NA,NA,no
list_1B,target,rrc,prog_rrc,loved,3,loved3,The kid loved,NA,NA,yes
list_1B,filler,filler,NA,NA,NA,Filler46,Maria went upstairs to,Did Maria change into a dress?,No,yes
list_1B,prime,prog_rrc,NA,described,1,described1,The boy being described by the lady glowed with joy.,NA,NA,no
list_1B,prime,prog_rrc,NA,described,2,described2,The secretary being described by the visitor waited patiently.,NA,NA,no
list_1B,target,rrc,prog_rrc,described,3,described3,The chemist described,NA,NA,yes
list_1B,filler,filler,NA,NA,NA,Filler45,Patrick woke up to,Were Patrick's parents around when he woke up?,No,yes
list_1B,filler,filler,NA,NA,NA,Filler13,The friends studied,Did the friends study independently?,No,yes
list_1B,filler,filler,NA,NA,NA,Filler9,Foreigners unfailingly fall in love with the place.,Did foreigners like the place?,Yes,no
list_1B,prime,rrc,NA,examined,1,examined1,The defendant examined by the lawyer turned out to be unreliable.,NA,NA,no
list_1B,prime,rrc,NA,examined,2,examined2,The engineer examined by a licensor passed with flying colors.,NA,NA,no
list_1B,target,rrc,rrc,examined,3,examined3,The industrialist examined,NA,NA,yes
list_1B,filler,filler,NA,NA,NA,Filler6,The married couple arose before dawn in order to prepare for the trip.,Did the couple wake up early?,Yes,no
list_1B,filler,filler,NA,NA,NA,Filler44,The bulldozers were removing,Was the building destroyed?,Yes,yes
list_1B,filler,filler,NA,NA,NA,Filler22,The rabbit hopped,Did the rabbit make it to the other side safely?,Yes,yes
list_1B,prime,prog_rrc,NA,envied,1,envied1,The officer being envied by the assistant quit the job.,NA,NA,no
list_1B,prime,prog_rrc,NA,envied,2,envied2,The principal being envied by the administration complained about the school's problems.,NA,NA,no
list_1B,target,rrc,prog_rrc,envied,3,envied3,The man envied,NA,NA,yes
list_1B,filler,filler,NA,NA,NA,Filler43,The contestants ate,Did the contestants eat less than 10 hot dogs?,No,yes
list_1B,prime,prog_rrc,NA,captured,1,captured1,The policeman being captured by the kidnapper refused to divulge any information.,NA,NA,no
list_1B,prime,prog_rrc,NA,captured,2,captured2,The witch being captured by the peasant cackled gleefully.,NA,NA,no
list_1B,target,rrc,prog_rrc,captured,3,captured3,The suspect captured,NA,NA,yes
list_1B,filler,filler,NA,NA,NA,Filler16,The deer froze in,Were the deer scared?,Yes,yes
list_1B,filler,filler,NA,NA,NA,Filler23,The businessman strode,Was the businessman determined?,Yes,yes
list_1B,filler,filler,NA,NA,NA,Filler3,A different kind of fire arose within Andrew as he thought about the new idea.,Was Andrew passionate about the idea?,Yes,no
list_1B,filler,filler,NA,NA,NA,Filler42,The dieting boy deprived himself of sweets and sugars.,Did the boy want to be healthier?,Yes,no
list_1B,prime,prog_rrc,NA,scratched,1,scratched1,The girl being scratched by the cat enjoyed the sunny afternoon.,NA,NA,no
list_1B,prime,prog_rrc,NA,scratched,2,scratched2,The toddler being scratched by the table exclaimed in surprise.,NA,NA,no
list_1B,target,rrc,prog_rrc,scratched,3,scratched3,The dog scratched,NA,NA,yes
list_1B,filler,filler,NA,NA,NA,Filler41,They drew lots to settle who should make dinner that day.,Did they draw lots to decide who should make lunch?,No,no
list_1B,prime,urc,NA,consoled,1,consoled1,The widow who was consoled by her family felt better eventually.,NA,NA,no
list_1B,prime,urc,NA,consoled,2,consoled2,The teenager who was consoled by the friend went back home sullenly.,NA,NA,no
list_1B,target,rrc,urc,consoled,3,consoled3,The woman consoled,NA,NA,yes
list_1B,filler,filler,NA,NA,NA,Filler40,The flags in the gym,Were the flags chosen at random?,No,yes
list_1B,prime,rrc,NA,attacked,1,attacked1,The troops attacked by the terrorists suffered heavy losses.,NA,NA,no
list_1B,prime,rrc,NA,attacked,2,attacked2,The lion attacked by the hunter staggered back into the forest.,NA,NA,no
list_1B,target,rrc,rrc,attacked,3,attacked3,The senator attacked,NA,NA,yes
list_1B,filler,filler,NA,NA,NA,Filler15,The basketball player's ankle swelled as he limped off the court.,Was the player injured?,Yes,no
list_1B,filler,filler,NA,NA,NA,Filler39,The wallpaper was,Was the wallpaper a bad choice?,No,yes
list_1B,prime,amv,NA,paid,1,paid1,The cashier paid the customer and muttered something inaudibly.,NA,NA,no
list_1B,prime,amv,NA,paid,2,paid2,The organization paid the government and expanded its misson.,NA,NA,no
list_1B,target,rrc,amv,paid,3,paid3,The broker paid,NA,NA,yes
list_1B,filler,filler,NA,NA,NA,Filler38,The school principal worked,Was the principal busy?,Yes,yes
list_1B,prime,urc,NA,accompanied,1,accompanied1,The prince who was accompanied by the duke arrived at the palace.,NA,NA,no
list_1B,prime,urc,NA,accompanied,2,accompanied2,The children who were accompanied by their guardian skipped to the park.,NA,NA,no
list_1B,target,rrc,urc,accompanied,3,accompanied3,The toddler accompanied,NA,NA,yes
list_1B,filler,filler,NA,NA,NA,Filler37,The girls on the basketball team,Were the girls lazy all summer?,No,yes
list_1B,prime,rrc,NA,recognized,1,recognized1,The man recognized by the spy took off down the street.,NA,NA,no
list_1B,prime,rrc,NA,recognized,2,recognized2,The actor recognized by the reporter waved enthusiastically.,NA,NA,no
list_1B,target,rrc,rrc,recognized,3,recognized3,The poet recognized,NA,NA,yes
list_1B,filler,filler,NA,NA,NA,Filler36,Each of the cab drivers had their own favorite route to get to the airport.,Was there more than one way to get to the airport?,Yes,no
list_1B,prime,amv,NA,chased,1,chased1,The dog chased the boy and played with the ball.,NA,NA,no
list_1B,prime,amv,NA,chased,2,chased2,The monkey chased a hatter and stole his hats.,NA,NA,no
list_1B,target,rrc,amv,chased,3,chased3,The thief chased,NA,NA,yes
list_1B,filler,filler,NA,NA,NA,Filler35,The storekeepers were afraid that,Were some people worried about the hometeam winning?,Yes,yes
list_1B,prime,urc,NA,studied,1,studied1,The soldier who was studied by the general moved up in ranks.,NA,NA,no
list_1B,prime,urc,NA,studied,2,studied2,The writer who was studied by the scholar wrote a radical book.,NA,NA,no
list_1B,target,rrc,urc,studied,3,studied3,The apprentice studied,NA,NA,yes
list_1B,filler,filler,NA,NA,NA,Filler34,The bathroom paint was,Was the paint in the hotel bathrooms in good shape?,No,yes
list_1B,prime,urc,NA,betrayed,1,betrayed1,The politician who was betrayed by the party denied the allegations.,NA,NA,no
list_1B,prime,urc,NA,betrayed,2,betrayed2,The king who was betrayed by the genie arrested the innocent woman.,NA,NA,no
list_1B,target,rrc,urc,betrayed,3,betrayed3,The businessman betrayed,NA,NA,yes
list_1B,filler,filler,NA,NA,NA,Filler14,The woman eagerly waited,Was the woman looking forward to hearing some news?,Yes,yes
list_1B,filler,filler,NA,NA,NA,Filler33,All the parents at the meeting,Did the parents like the new policy?,No,yes
list_1B,prime,rrc,NA,challenged,1,challenged1,The protestors challenged by the authority marched on the streets.,NA,NA,no
list_1B,prime,rrc,NA,challenged,2,challenged2,The scientist challenged by the journalist demonstrated the value of the invention.,NA,NA,no
list_1B,target,rrc,rrc,challenged,3,challenged3,The dragon challenged,NA,NA,yes
list_1B,filler,filler,NA,NA,NA,Filler8,The student pretended,Was the student really sick?,No,yes
list_1B,filler,filler,NA,NA,NA,Filler20,The children shrank back from the clown in revulsion.,Did the children like the clown?,No,no
list_1B,filler,filler,NA,NA,NA,Filler19,The energetic cat batted at the dust specks floating in the air.,Was the cat lazy?,No,no
list_1B,filler,filler,NA,NA,NA,Filler10,The jogger inhaled,Was the jogger out of breath?,Yes,yes
list_1B,filler,filler,NA,NA,NA,Filler32,The pilots flew,Did the pilots enjoy themselves in the city?,Yes,yes
list_1B,prime,amv,NA,selected,1,selected1,The applicant selected the company and gained more information.,NA,NA,no
list_1B,prime,amv,NA,selected,2,selected2,The professor selected the university and made plans to move to a new city.,NA,NA,no
list_1B,target,rrc,amv,selected,3,selected3,The chef selected,NA,NA,yes
list_1B,filler,filler,NA,NA,NA,Filler31,The laptops were,Were the laptops afforable for the students?,No,yes
list_1B,prime,rrc,NA,congratulated,1,congratulated1,The captain congratulated by the team jumped in excitement.,NA,NA,no
list_1B,prime,rrc,NA,congratulated,2,congratulated2,The actress congratulated by the director talked to the media happily.,NA,NA,no
list_1B,target,rrc,rrc,congratulated,3,congratulated3,The governor congratulated,NA,NA,yes
list_1B,filler,filler,NA,NA,NA,Filler30,The film critic wept at,Was the film critic incapable of crying?,No,yes
list_1B,filler,filler,NA,NA,NA,Filler11,The singer practiced,Was the singer able to hit the high notes without practicing?,No,yes
list_1B,prime,amv,NA,encouraged,1,encouraged1,The gymnast encouraged the coach and participated in the contest.,NA,NA,no
list_1B,prime,amv,NA,encouraged,2,encouraged2,The musician encouraged the crowd and performed a breathtaking piece.,NA,NA,no
list_1B,target,rrc,amv,encouraged,3,encouraged3,The teacher encouraged,NA,NA,yes
list_1B,filler,filler,NA,NA,NA,Filler2,The ornate clock chimed,Was the clock working?,Yes,yes
list_1B,filler,filler,NA,NA,NA,Filler29,The sparkles on the celebrity's dress glittered under the harsh lighting.,Did the outfit have sparkles on it?,Yes,no
list_1B,filler,filler,NA,NA,NA,Filler17,The boy got up to,Did the boy get out of his seat?,Yes,yes
list_1B,filler,filler,NA,NA,NA,Filler7,The spy came,Did the spy make a lot of noise?,No,yes
list_1B,prime,urc,NA,identified,1,identified1,The thief who was identified by the victim ran away in fear.,NA,NA,no
list_1B,prime,urc,NA,identified,2,identified2,The warden who was identified by the prisoner cracked the walnuts enthusiastically.,NA,NA,no
list_1B,target,rrc,urc,identified,3,identified3,The student identified,NA,NA,yes
list_1B,filler,filler,NA,NA,NA,Filler28,The girl apologized,Was the girl caught staying out late?,Yes,yes
list_1B,prime,prog_rrc,NA,admired,1,admired1,The singer being admired by her fans sang beautifully.,NA,NA,no
list_1B,prime,prog_rrc,NA,admired,2,admired2,The princess being admired by the magician went into a trance.,NA,NA,no
list_1B,target,rrc,prog_rrc,admired,3,admired3,The employee admired,NA,NA,yes
list_1B,filler,filler,NA,NA,NA,Filler27,The teacher saw,Was the teacher fooled by the student?,No,yes
list_1B,filler,filler,NA,NA,NA,Filler21,The chairman spoke,Did the chairman speak for 45 minutes?,No,yes
list_1B,prime,amv,NA,approached,1,approached1,The student approached the teacher and passed the exam.,NA,NA,no
list_1B,prime,amv,NA,approached,2,approached2,The clerk approached his manager and submitted the report.,NA,NA,no
list_1B,target,rrc,amv,approached,3,approached3,The spy approached,NA,NA,yes
list_1B,filler,filler,NA,NA,NA,Filler4,John became frustrated,Did John get less frustrated over time?,No,yes
list_1B,filler,filler,NA,NA,NA,Filler26,The fish swam,Did the fish avoid Jane?,No,yes
list_1B,filler,filler,NA,NA,NA,Filler1,The new student talked,Were there some classmates the new student did not talk to?,No,yes
list_1B,prime,amv,NA,introduced,1,introduced1,The speaker introduced the chairman and charmed everyone with the speech.,NA,NA,no
list_1B,prime,amv,NA,introduced,2,introduced2,The producer introduced the association and won many awards.,NA,NA,no
list_1B,target,rrc,amv,introduced,3,introduced3,The elf introduced,NA,NA,yes
list_1B,filler,filler,NA,NA,NA,Filler12,The babysitter ran,Were the children well behaved?,No,yes
